"GranBar - tapasbar, vinbar, kaffebar",JB-Borup,11. september 2019,"Det er en hyggelig café  og personalet er søde. Jeg fik en lækker kyllingesalat. Der var lidt forvirring omkring drikkevarerne. Tjeneren vidste ikke helt, hvilken øl der var hvad, men jeg tror, at folk fik det, de havde bestilt",4,Horsens
"GranBar - tapasbar, vinbar, kaffebar",BRUGER9,10. august 2019,"Superlækre tapas og sød og hurtig betjening trods mange gæster. Vi sad udenfor, hvor der var rigtig god stemning, men det så også cool ud indenfor. Kan klart anbefales:-)",5,Horsens
"GranBar - tapasbar, vinbar, kaffebar",Pernille Ødum H,8. august 2019,"Vi besøgte Horsens i forbindelse med en koncert. Vi havde fundet GranBar via Tripadvisor og de levede absolut op til anmeldelserne.

Rigtig lækker tapas af høj kvalitet. Nærværende betjening og god service. Kan absolut anbefales.",4,Horsens
"GranBar - tapasbar, vinbar, kaffebar",jopi2016,28. juni 2019,Iskaffen var RIGTIG GOD med velsmagende sirup dertil saltmandler og delikate oliven. De lækre tapasbrætter vil vi glæde os til næste gang. Vi nød synet af dem ved nabobordet.,4,Horsens
"GranBar - tapasbar, vinbar, kaffebar",frubdenmark,14. februar 2019,"Der er hyggeligt på Gran. Smart og lækkert indrettet. Vi var der til brunch. Vi havde bestilt bord og var der til brunch. Skøn tallerken med røræg, bacon, en hønsesalat i salatblad, spansk pølse og en skyr med bær og knas. Lækkert. Man kan tilkøbe pandekager og andre lækkerier. Det glemte tjeneren at spørge om. Faktisk glemte tjeneren os flere gange. Jeg undre mig over med tre ansatte i bar og på gulvet og hvor ikke alle borde er besatte, hvorfor man ikke går mere rundt ved sine gæster. Vi måtte kalde de gange vi ville bede om mere kaffe. Derfor mangler der en stjerne fra mig! Skønt sted og skøn mad. Vi kommer igen og spiser der! ",4,Horsens
"GranBar - tapasbar, vinbar, kaffebar",vitan2014,27. maj 2018,Dejligt lille sted med udeserverring. Det er et lækkert sted hvor de har en lækker tappas  for 2 personer lækkert brød,5,Horsens
"GranBar - tapasbar, vinbar, kaffebar",ibpotter,7. oktober 2017,"Havde ikke tid til at sidde ned. Så ellers hyggeligt ud. Lækker tappas. 

Men lugen vendt ud mod gaden gjorde, at jeg bestilte en Americano to Go. 

Mega lækker.",5,Horsens
"GranBar - tapasbar, vinbar, kaffebar",jopi2016,3. september 2017,"Vi kom igen - men var skuffede. 
Anretningen ikke på niveau som sidst - men stadig fin. 
Brødet meget sejt og svært at skære igennem. 
Pas nu på der ikke går fabrik i det !",3,Horsens
Granbar,Anne M,"September 23, 2017","Very cozy place to sit and have a drink in the sun. Simple but lovely surroundings, and the food looks absolutely delicious.",4,Horsens
Granbar,grggmrtn,"April 8, 2017","It was cold out so we ate inside. Not many seats but REALLY cozy. And the sandwiches? Omg the black bread (malt?) was soooo good! Awesome ingredients, great range of choice... Very helpful and friendly staff. I'll be back again. And again. And again.",5,Horsens
Granbar,CristinaM5079,"October 26, 2016","This place is usually full with noisy, drunk people.I have been there just ones and the service was really bad. The wine was warm.",1,Horsens
Granbar,SonHen,"July 2, 2016","They serve good drinks and tapas,,and has really nice outdoor seating, but they're closed at the best times!",3,Horsens
Soy7,idaj699,30. marts 2021,"Jeg bestilte en rød curry, som desværre var den dårligste jeg nogensinde har smagt. Ingen smag, et tykt lag flydende fedt øverst, ukogte kartofler og grønsagerne er tydeligvis lige kommet ud af en frostpose. Ikke engang risene var gode, de var helt smattede. Kan ikke anbefales.",1,Horsens
Soy7,646clauss,26. september 2019,"Nydelige lokaler med olads til 14 personer.
Serviceminded servering der laves thai samt sushi sim jeg varmt kan anbefale.",5,Horsens
Soy7,mera0504,6. september 2019,"Lækker og veltilberedt Thai mad, god smag og helt tilpas stærkt. Så lækker Pa Nang og Cashew ret 😀😀 Stor anbefaling herfra",5,Horsens
Soy7,Kirsahalager,28. august 2019,"Virkelig lækker og frisk thaimad med de mest kendte retter, feks. Kylling cashew og Phad Thai. Alt til helt ok priser! Restauranten er fin og ren, og personalet er virkelig venlige;)",5,Horsens
Soy7,Bent T,14. juli 2019,"Maden er virkelig god og får en til og tænke på sine madoplevelser ude i Asien.
God mad tager tid og fremstille med friske råvarer.
Prismæssigt i den dyre ende, men en oplevelse.
Kan anbefale T1+ 7+ 8",4,Horsens
Soy7,Erik H,10. september 2018,"Frisklavet, velsmagende sushi, dejlige og skønt spicede thairetter. Søde mennesker. Rent og pænt. Fornuftige priser. Kommer igen",4,Horsens
Soy7,LineBangL,31. maj 2018,Vi bestilte heldigvis kun en lille “menu” for at prøve deres Sushi. Det var virkelig dårligt. Vi fik en lille boks med inside-out - en variant med krabbe og en variant med laks. Styrkerne var tørre og smagsløse. Tangen var sej. Man kunne lugte laksen. Det kan IKKE anbefal ,1,Horsens
Soy7,883larsr,7. april 2018,Super godt og god service. Samt rigtig pænt og rent. Er ikke så stort men det betyder bestemt ikke noget. Vil gerne hente take Away her.,5,Horsens
Soy7,638heller,7. april 2018,Spiste på stedet. Småt men hyggeligt og utrolig god service og fantastisk mad. Kommer HELT sikkert igen,5,Horsens
Soy7,andersj84,8. marts 2018,"Vi har flere gange fået take away fra soy7 og det kan kun anbefales! Tidligere har jeg/vi kun prøvet deres sushi, og det er super lækkert og frisk! Nu har jeg også prøvet nogle af deres varme retter (suppe og ret med ris) og det kan også klart anbefales. Når man kommer i restauranten er personalet altid venlige og smilende. Bestemt ikke sidste gang vi bestiller mad der.",5,Horsens
Soy7,rogercabiscol,"March 17, 2018","I have eaten there many times. Always top quality, taste and treatment. Fast delivery and good price :D",5,Horsens
Vegetarzan,jensmollerc,21. august 2021,"Var forbi med min familie igår fredag, vi fik en oplevelse med dejlig mad og nye smagsoplevelser. Vi prøvede 3 forskellige retter med nogle af deres drikke. Vi bestilte Churrasco, Harrisa og Curry, alle lækkere retter. Priserne er rigtige gode. Personalet behagelige og smilende. Skønt at være veganer.",5,Horsens
Vegetarzan,319helleh,2. oktober 2020,Vi fik take away mad. Fik lækker salat og velsmagende små brød med. Lagde slet ikke mærke til der ikke var kød i retterne. Kan kun anbefales ☺,5,Horsens
Vegetarzan,768signep,18. september 2020,"Virkeligt lækkert mad og god betjening. Også ""kødspiseren"" kunne finde noget tiltalende. Man behøver altså ikke at være veganer for at kunne finde noget genkendeligt. Kæmpe anbefaling herfra!",5,Horsens
Vegetarzan,F8767USanner,19. august 2020,"Vi er ikke inkarnerede vegetarer eller veganere, men bestilte i dag take-away - der var super lækker, godt krydret og perfekt tilberedt - med dejligt tilbehør i form af friskbagt lunt brød, salat, topping og r ",5,Horsens
Ming Hao,Elleand116,27. september 2021,"Super fantastisk oplevelse.
Ejeren var rigtig sød.
Gode priser og fantastisk mad.
10/10 vil super gerne spise hos ming hao igen.",5,Horsens
Ming Hao,walkawaygirl,29. marts 2021,"Ville prøve en sushi menu der ikke sprang pengepungen, og besluttede efter udelukkelsesmetoden at prøve Ming Hao a ",5,Horsens
Ming Hao,Sofie0811,30. oktober 2020,"Vi sidder tre venner en fredag aften, og tænker vi skal ud og spis ",1,Horsens
Ming Hao,stolligCh,10. januar 2020,Elsker at komme de ,5,Horsens
Ming Hao,Valjevci,7. oktober 2019,Det ligner en slidt restaurant og ser beskidt ud hvor står mad. Dårligst kinesiske restaurant som har jeg været og unge tjenere ses syre ud. En skuffelse. 😪,2,Horsens
Ming Hao,Annette A,15. juli 2019,"Besøgte Ming Hao sammen med 19 kollegaer. Restauranten er lidt storspil den er ikke hyggelig, der var arrengeret et langt bord. 
Maden er der nok af men den smager ikke af særlig meget, mangler i den grad krydderi.",3,Horsens
Ming Hao,Jens_Jensen,4. juli 2019,"Stedet har rigtig god mad med et godt udvalg af diverse asiatiske retter. Skulle de have 5 stjerner, skulle de være nemmere at parkere (kun 1 times parkering lige udenfor, ellers dyr betalingsparkering lidt længere derfra) + de klinkebelagte gulve og ingen større skillevægge eller andre adskillelser af det meget store lokale, gør at der er rigtig meget larm, selv når man er langt væk fra legeområdet pga folks snakken ved bordene. ",4,Horsens
Ming Hao,Charlotte S,9. juli 2018,Super god service og fantastisk god mad med mange forskellige ting at vælge i mellem. Altid venlige tjenere og atmosfæren er skøn.,5,Horsens
Ming Hao,MichaelAnd12,30. juni 2018,"Rigtig og stille sted, med god mad. Betjeningen er god og med en god humor. Kan varmt anbefales. Kommer helt sikkert igen.",4,Horsens
Ming Hao,HansenEjer,28. april 2018,Ming Hao er en klassisk kinesisk buffet restaurant. Det er muligt at bestille fra menu kortet men de fleste bestiller buff ,4,Horsens
Ming Hao,MichaelAnd12,"June 30, 2018","Rigtig og stille sted, med god mad. Betjeningen er god og med en god humor. Kan varmt anbefales. Kommer helt...More",4,Horsens
Ming Hao,HansenEjer,"April 28, 2018",Ming Hao er en klassisk kinesisk buffet restaurant. Det er muligt at bestille fra menu kortet men de fleste bestiller...More,4,Horsens
Ming Hao,391larsk,"April 18, 2018",Var der en søndag aften og fik buffet. Maden var rigtig god og det er utroligt dejligt at der er...More,4,Horsens
Ming Hao,Steffen D,"March 10, 2018",Jeg besøgte Ming Hao alene en fredag sen eftermiddag kort efter at restauranten åbnede kl. 16:30.. Jeg havde læst gode...More,2,Horsens
Ming Hao,388tineb,"February 17, 2018","Altid plads og altid bliver man modtaget med smil. Buffeten har et stort udvalg af lækkert mad, og der bliver...More",4,Horsens
Ming Hao,bnolesen,"February 13, 2018","Valgte deres buffet, mange gode retter både kinesiske og sushi. Mongolian barbeque, hvor de steger maden man har valgt er...More",4,Horsens
Ming Hao,olem673,"January 22, 2018","Man får fuld valuta for pengene og det er ganske spændende at udforske de forskellige veltillavede kinesiske retter.
Det er...More",4,Horsens
Ming Hao,Heidi Schell Hø... C,"December 4, 2017","Lokalerne er flotte og velholdte. Betjeningen var yderst venlig, der blev hurtigt fjernet service fra bordet. Maden var super lækker....More",5,Horsens
Ming Hao,claand1968,"September 4, 2017",Har prøvet Ming Hao flere gange og kan helt klart anbefale at prøve deres buffet. Specielt om aftenen har de...More,5,Horsens
Ming Hao,BGitteB,"August 4, 2017","Har besøgt Ming Hao flere gange. Hvor vi har nydt godt af deres gode buffet, som indeholder suppe, sushi, Mongolian...More",5,Horsens
Sakura Sushi Bar,972iulianar,14. juni 2021,"Var i dag til frokost og fik brændte rejer i sushi rolls. En er det dårligste sushi jeg har prøvet i mit liv. Har også sagt det når har betalt men det ignoreres, dårligt stil og servis!!!  Det eneste var godt det er sodavand….",2,Horsens
Sakura Sushi Bar,Pernillepihem,4. september 2020,Øv det fungere bare ik ,2,Horsens
Sakura Sushi Bar,829andersj,17. april 2020,Vi bestilte en masse sushi via hjemmesiden som blev afleveret til en anden person. Så får man et blik som om det er ens egen skyld. Hvis i har så travlt at i ikk har styr på det så tjek dog ordrenummeret i stedet for blot at sige et nav ,1,Horsens
Sakura Sushi Bar,Sebastian S,6. januar 2020,"Vi var tre der fik running sushi. Det er ikke noget fancy, de har få forskellige slags sushi at vælge mellem og et par andre retter. Smagen er ikke noget specielt, det er i hvert fald kvantitet over kvalitet, hvilket jeg personligt synes er synd, når man taler om sushi. Det var fint at være der en gang, men jeg kommer der ikke igen.",3,Horsens
Sakura Sushi Bar,Elisa H,6. september 2019,Meget beskidt bånd sushien kører rundt på og sushien er blevet kedelig og er dårligere i kvalitet end i starten..,1,Horsens
Sakura Sushi Bar,annececilie2003,23. august 2019,"Til prisen er det helt i orden. Velsmagende og frisk sushi. Hvis man efterlyser noget bestemt, går man bare op og siger det, og så er det på båndet indenfor 5-10 min. Kommer gerne igen.",5,Horsens
Sakura Sushi Bar,nisseboio,18. april 2019,"Hvis du er til halv lugtende, småt og utroligt mayonaise fyldt sushi så rammer du vidst stedet men for gør noget godt for jer selv og gå et andet sted hen. Altså egentlig så var det hele ganske fint ud over maden. Dog skal det siges hvis du kan lide din sushi med mere mayonaise end fisk så er dette stedet.",2,Horsens
Sakura Sushi Bar,Lone G,13. april 2019,"Altid god og velsmagende mad. Fornuftige priser og altid venligt og smilende personale. Hvis man synes der mangler noget, så beder man om det, og det kommer inden længe på båndet",4,Horsens
Sakura Sushi Bar,charlotte m,12. februar 2019,"Super lækker buffet 😍 og altid smilende og hjælpsomme tjenere 👍
Hyggeligt og rent. 
Toiletterne er pæne og rene 👍",5,Horsens
Sakura Sushi Bar,Charlotte Dupon... M,27. august 2018,"Elsker jeres sushi 🍥 topklasse 😍
Både i restauranten og som take away. 
Det sødeste personale, altid smilende og hjælpsomme 😊👍
Kan kun anbefale. ☀️☀️☀️☀️☀️",5,Horsens
Sakura Sushi Bar,Pola1950,"February 19, 2021","Good quality sushi ! We love to order the food from here, because we are never disappointed .A bit expensive but quality is high",5,Horsens
Sakura Sushi Bar,piotrbU5967WG,"December 20, 2017","The dishes tasted similiar to each other and were oversalted, but the atmosphere was great, enjoyed the experience a lot.",4,Horsens
Sakura Sushi Bar,markusw960,"October 5, 2017","We had a great dinner there, the sushi tastes fresh and comes in a wide variety. Would recommend it for big hunger and a nice evening.",4,Horsens
Sakura Sushi Bar,TatiKlinik,"August 23, 2016","Since I choose a vegan lifestyle I can be what some might call picky with my food. This place has a menu called vegetarian, but trust me it is actually vegan ;)
Good food and service was impecable. Waiting time wasn't longer than it should be. 

So all in all a great experience for both myself and my friends which don't share my lifestyle. Visited already twice, but since my own clinic is on the other way of the street I will certainly visit it again.",5,Horsens
Sakura Sushi Bar,runel679,"August 12, 2016","Visited this restaurant in Horsens on our vacation in Denmark a few weeks ago. We came a bit late, but we were welcome to eat with a smile. The food however was quite mainstream, but OK presented and we get sated.
Nice atmosphere and nice waitress.",3,Horsens
Sakura Sushi Bar,thomasdU1882AP,"January 5, 2016","Tried this back in july, where we ordered 2 menus. Both were actually really bland and boring. Each piece tasting like the next, no eyecandy... just plain boring.. Wouldnt do it again",3,Horsens
Sakura Sushi Bar,1classtraveler,"December 15, 2015",We have been at this restaurant many times. The food is fresh and delicious. If something is missing on the belt you ask and it will be made in a flash. Yammi.,5,Horsens
Sakura Sushi Bar,WanderlustCassis,"July 9, 2015","They had their own vegetarian menu! It was filling and delicious :) I'm not sure if it was vegan but I think it was...
The atmosphere was lovely and the waitress was nice. I would really recommend this place to all sushi lovers!",5,Horsens
Amalielund Mad,monas766,13. november 2020,Super lækkert og til en rigtig god pr ,4,Horsens
Amalielund Mad,344pernillea,20. august 2019,"Tapas anretning er helt sikkert værd at prøve. Der er rigtig meget forskelligt og noget for enhver smag. Fisk, kød, grønt, frugt, ost og kage",5,Horsens
Amalielund Mad,Kenn J,12. juli 2019,I Golf klubbens skær ligger på toppen af bakken en dejlig perle . Der er et stort udvalg men med alle retter i høj kvalitet ... ikke en rode butik men en mål rettethed på kvalitet og god service .,5,Horsens
Amalielund Mad,BenteH701,8. november 2018,Dejlig bespisning i forb. med barnedåb - først kage tapas og dernæst fiskeret og isdessert. Hyggeligt ‘festlokale’ udendørs i telt - heldigvis på en tørvejrsdag,4,Horsens
Amalielund Mad,Z560UEdana,22. april 2018,"Dejlige omgivelser, rigtig god mad og super betjening. 1.ste besøg på denne restaurant og helt sikkert ikke sidste.
Godt sted til familie arrangementer.
Tak til Pernille og Henrik.",4,Horsens
Amalielund Mad,Annette N,16. november 2017,"Fik serveret Golfrestaurantens november-menu.
2 retter mad for kun 125 kr.
Maden var lækker og varm og fint anrettet og serveret.",4,Horsens
Amalielund Mad,M8121SFdavidk,13. juli 2017,"En lækker frokost fik vi serveret en torsdag middag. Stort spisekort som normalt plejer at betyde at det stikker I alle retninger når der både er pizza,pasta,fisk og kødretter samt smørrebrød, men trods det var en stor omgang at finde rundt i menuen så var kvaliteten i t ",4,Horsens
Amalielund Mad,Annette N,25. maj 2017,"Lækker mad, veltillavet og til rimelige priser. Med den skønneste udsigt over Horsens golfbane i fuld sol, kan det næsten ikke blive bedre.",4,Horsens
Amalielund Mad,wilwe,7. maj 2017,"Det er et spisested der ligger i forbindelse med Horsens Golfklub, men fungerer som selvstændig restaurant. God mad og vi prøvede deres maj 2017 menu. Super godt med hovedret og dessert for blot 125 kr pr person. Vi sad ved et vindue og kunne se ud over den smukke natur og enkelte golfspillere som i det fjerne ledte efter huller og bolde. Meget venlig og hurtig betjeni ",5,Horsens
Jensens Bøfhus Horsens,Annette T,9. juli 2021,"Fik en god modtagelse af en frisk vært. Vi fik burgers, bearnaisebøf og kyllingebryst og det smagte virkelig godt. Dejligt at man kan få kartofler og sovs ad libitum. Tjeneren Simon var frisk og spurgte 3 gange til om vi manglede noget. Hurtig betaling. Kommer helt sikkert igen ",4,Horsens
Jensens Bøfhus Horsens,jopi2016,8. maj 2021,MADEN var OK til prisen - det var bøf og burger. Men lokalet er slidt og kedeligt ude og inde og bærer præg af slid.,3,Horsens
Jensens Bøfhus Horsens,660steffenj,15. oktober 2020,Min forlovede og jeg var på Jensens bøfhus i Horsens og det var mildtsagt det dårligste restaurant besøg jeg har haft. Fra vi bestiller går der 40 min før vores snack kurv kommer og mere end en time før vi får hovedretten der til skal det siges at jeg bestiller den dyreste bøf på kortet og da den efter lang tids venten kommer er den rå og jeg bestilte den Well done. Jeg kalder på en tjener og hun spørg så om de bare kan stege den færdig. Sådan noget spørg man ikke om man laver bare en ny og det er med det samme.,1,Horsens
Jensens Bøfhus Horsens,Pernillepihem,4. september 2020,"Hmm. Det vil aldrig blive top klasse mad, men super god betjening og vi er vilde med deres nye menu kort og take away.
Nå ja og cheesecake, den kan varmt anbefales",3,Horsens
Jensens Bøfhus Horsens,Hrjolls,15. februar 2020,"Rigtig god og sød service. Maden er den samme som altid, og det er jo derfor man går på Jensens 
Desværre virkede salatbar ikke ved ankomst og ingen gjorde opmærksom på den igen virkede.",4,Horsens
Jensens Bøfhus Horsens,Z560UEdana,12. februar 2020,Super dejlig oplevelse med familie. Dejlig afslappet og kyndig betjening. God mad og tilbehør. Kommer meget gerne igen.,5,Horsens
Jensens Bøfhus Horsens,359gitteg,25. december 2019,Vi havde bestilt take away ved skrank ,2,Horsens
Jensens Bøfhus Horsens,Gunnar S,25. oktober 2019,"Vi valgte Jensens bøfhus, da vi kun var lidt sultne og det skulle gå hurtigt. Vi fik en god og venlig velkomst. Vi fik liv selv at vælge bord, da der var en del ledige. Vi bestilte en efterårsmenu og kylling. Begge dele var gode. Alt i alt en god frokost i forhold til prisen",4,Horsens
Jensens Bøfhus Horsens,KarinHarder,19. september 2019,"Der var utrolig lang ventetid på maden, pomfritterne var kedelige, burgeren var kedelig og kødet smagte mærkeli ",2,Horsens
Jensens Bøfhus Horsens,jopi2016,17. september 2019,"Det er så ærgerligt at lade maden gå ud igen - selvom muligheden for det er der. Så sidder den ene og spiser færdig, mens den anden venter og venter. Den anledning vi var gået ud for at fejre blev forstyrret og den aften vi havde set frem til blev ikke som vi havde håbet! Så jeg kæmpede mig igennem bøffen og min bedre 1/2del næsten ligeså! Der stod bøffen skulle være saftig og mør? Det var den ikke - hvad siger JENSEN mon til det?",3,Horsens
Jensens Boefhus Horsens,SonHen,"July 21, 2011",This is a total rip off. You have to drown the cardboard meat in sauce to get some flavour. The side dishes were obviously mass produced. This could have been any American chain restaurant that you visit when everything else is closed.,1,Horsens
Jensens Boefhus Horsens,englaender,"December 7, 2008","Jensens is a chain, and this one is no better or worse than the others. Its just as average. 

I felt ripped off when I ate here, paying 25 euro for a steak and chips, when the steak it just standard ""supermarket"" fayre devoid of...More",2,Horsens
Sam's Salat,hautho,12. december 2019,"Fik en rigtig dejlig sandwich til frokost, frisk og velsmagende. 

Super god Betjening

Meget hyggeligt spisested, hvor man kan indtage sin mad i hyggelige omgivelser",5,Horsens
Sam's Salat,DRAW WITH D,24. maj 2019,"Fint hyggeligt lille sted, med god atmosfære. Ok udvalg af salater. Nogle få ""varme"" ""retter"". Købte en samosa og en falaffel lignende rund tingeste, som under spisningen bar præg af at havde ligget for lang tid og gået hen og blevet lunken og blød. Nogle af beholderne i salat baren var tomme. Prisen var lidt i overkanten.....kommer jeg igen??? måske ...salat er jo...salat.....og det kræver jo ikke den store kokke kunst...:) og så lige for at se, om der skulle være nogle frisklavet samosaer...(dem elsker jeg! når de er ny lavet)",3,Horsens
Sam's Salat,254tanjaj,8. marts 2017,Salatbaren har godt udvalg af gode og friske råvarer men det bliver hurtigt rigtigt rigtigt dyrt for en omgang salat.,4,Horsens
Sam's Salat,liner453,17. februar 2017,Var på besøg til en let frokost. Fin salatbar med gode velsmagende råvare ,4,Horsens
Sam's Salat,SigneFlorin,12. februar 2017,Super lækker salatbar med alt hvad hjertet kunne begærer. Har også smagt deres sandwich der er i samme høje kvalitet.,4,Horsens
Sam's Salat,LSMadsen,19. januar 2017,"Et fint sted, hvor jeg har købt velsmagende sandwiches som take away et par gange. Der er også en større salatbar med en masse at vælge imellem.",4,Horsens
Sam's Salat,Clemens2205,29. marts 2016,"Rigtig fin lille salatbar. Der er et varieret omend lidt begrænset udvalg af forskellige salater. Det er nemt at blande en sund, velsmagende og billig frokost. Kan klart anbefales.",4,Horsens
Sam's Salat,juliemdh,4. februar 2016,Det er dejligt med en Salatbar i byen. Jeg håber dog de med tiden får et større udvalg af bland selv salat.,4,Horsens
Sam's Salat,Kvists_billedbog,17. oktober 2015,"Der er ingen tvivl om at Sam's Salat er byens bedste salatbar, da der ikke findes andre i Horsens. Men havde der været nogen som tog konkurrencen op, så skulle de virkelig oppe sig fordi niveauet er sat høj ",4,Horsens
Sam's Salat,Henrik Ø,1. juni 2015,"Ingen over eller ved siden af Sams Salat. Til en absolut rimelig penge får man her altid frisk og velsmagende salatbuffet med et mellemøstligt twist. Det fås ikke bedre i miles omkreds og sammenlignet med den elendige frokost-mad, man ellers får i Horsens er dette en sand stjernestund.",5,Horsens
Sam's Salat,TatiKlinik,"August 23, 2016",Great bland yourself choices for a take away meal. I often buy from there since I work close to the place.,5,Horsens
Sushi Takumi,Christina L,17. august 2021,"Smart ad libitum løsning hvor der bestilles nemt via tablet.

Lidt kedelig udvalg af sushi- de gængse sushi ingredienser (avokado, laks, tun, tempurarejer, and og kylling)

Små spyd med kylling, okse, bacon/asparges osv.",5,Horsens
Sushi Takumi,Mikkel4050,22. juli 2021,Et travlt spisested med lidt knas i det tekniske. Men de kvindelige værtinder var meget hjælpsomme. Den serverede sushi var absolut lækker og der er mange forskellige at vælge imellem. Bestillingssystemet var nemt at bruge. En god smagsoplevelse i travle omgivelser.,4,Horsens
Sushi Takumi,alvildam,15. september 2020,"Jeg har spist meget sushi, og sjældent har det været så friskt som sushi Takumi's, som virkelig er frisklavet og af super kvalitet - kan virkelig klart anbefales.",5,Horsens
Sushi Takumi,SUSHAN100,11. april 2020,"Jeg har før spist på restauranten, hvor jeg var tilfreds med køb ",3,Horsens
Sushi Takumi,Cecilie J,1. marts 2020,"Det er svært at klage over servicen, for der var ingen. Sørgel ",2,Horsens
Sushi Takumi,HENRlK_SOMMER,27. januar 2020,Det er ikke første gang vi er her og det bliver heller ikke sidste ga ,4,Horsens
Sushi Takumi,U6771GGcharlottes,3. januar 2020,"Skøn sushi restaurant. Kvaliteten er i top, ser skøn ud og smager himmelsk. 208 kr for All you can eat sushi og 50 kr for et STORT glas vin - det må siges at være en ok pris. Sød og venlig betjening. Kommer helt sikkert igen. ",5,Horsens
Sushi Takumi,920flemmingl,13. december 2019,"Spiste på stedet i går sammen med gode venner. Stedet er forholdsvis nyt, og det var mit første bes ",5,Horsens
Brætspilscaféen,mate0s15,3. august 2020,"Vi har besøgt caféen flere gange, og hver gang bliver man mødt af de søde engagerede ejere, der hjælper og guider med at finde et godt spil. Caféen ligger centralt i Horsens centrum og det er et hyggeligt sted at slå sig ned.Man kan købe god kaffe,te, specielt øl, vin og rigtig gode cocktails. Alt til en rigtig god pris. Vi glæder os hver gang til at komme. Hvis man vil i byen en aften er det et super godt alternativ til hvad Horsens ellers har at byde på, med risiko for at blive hængende. ",5,Horsens
